{
  "_comment": "模型最终结构化摘要；trace.tool_result 通过 artifact_id 引用本文件",
  "schema_version": "ticket_summary_v1",
  "ticket_ref": "T-XXXX",

  "summary": "上午 10:00 起多名用户 VPN 认证失败（'authentication failed' / 'ike sa establishment failed'），现象不限单端（已交叉验证：换机器、4G 热点均失败），优先怀疑服务端鉴权链路。",

  "symptoms": [
    "authentication failed",
    "ike sa establishment failed"
  ],

  "scope": "multiple_users",

  "tried_steps": [
    "重启 VPN 客户端",
    "更换网络（4G 热点）",
    "更换终端"
  ],

  "missing_fields": [
    "VPN 客户端版本",
    "用户名 / 受影响账号清单",
    "10:00 前后是否有变更窗口"
  ],

  "next_actions": [
    {
      "action": "确认 VPN 网关 / 认证服务（RADIUS / AD LDAP）健康",
      "rationale": "多人同时认证失败基本指向服务端鉴权链路（不是单端）",
      "citations": ["kb-1"]
    },
    {
      "action": "向用户索取客户端版本与受影响账号清单",
      "rationale": "缺失字段会阻碍 L2 复现",
      "citations": []
    },
    {
      "action": "检查 10:00 前后是否有变更窗口（DNS / 证书 / 防火墙）",
      "rationale": "证书过期或时间不同步会引发认证失败",
      "citations": ["kb-1"]
    }
  ],

  "severity_suggested": "P2",

  "escalation_hint": "多人受影响 + 服务端日志无认证记录 → L2 网络组",

  "citations": [
    {
      "id": "kb-1",
      "chunk_id": "chk_0cf89826",
      "document_id": "doc_e5f6g7h8",
      "source_path": "examples/scn_ticket_summary_zh/kb/sop_vpn_zh.md",
      "line_start": 37,
      "line_end": 46,
      "heading_path": ["VPN 故障排查 SOP", "2. 排查顺序", "2.1 认证错误"]
    }
  ]
}
